 Use Code,Use,TreatmentTherapeutic_Area
U-1761 ,plaque psoriasis,['DERMATOLOGY (109) ']
U-1796 ,topical treatment inflammatory papules pustules mild moderate rosacea,['DERMATOLOGY (109) ']
U-1727 ,topical treatment inflammatory papules pustules mild moderate rosacea,['DERMATOLOGY (109) ']
U-1841 ,"use long-term, maintenance treatment airflow obstruction patients chronic obstructive pulmonary disease (copd)",['PULMONARY/RESPIRATORY DISEASES (135) ']
U-1068 ,treatment asthma,['FAMILY MEDICINE (624) ']
U-2001 ,use treatment asthma patients 6 years age older,['FAMILY MEDICINE (624) ']
U-2002 ,use maintenance treatment chronic obstructive pulmonary disease,['FAMILY MEDICINE (624) ']
U-2122 ,use reducing exacerbations chronic obstructive pulmonary disease,['PULMONARY/RESPIRATORY DISEASES (135) ']
U-636 ,treatment prevention bronchospasm asthmatic symptoms,['FAMILY MEDICINE (624) ']
U-1787 ,treatment exocrine pancreatic insufficiency,['GASTROENTEROLOGY (105) ']
U-949 ,healing grades erosive esophagitis (ee) 8 weeks,['GASTROENTEROLOGY (105) ']
U-950 ,maintain healing erosive esophagitis (ee) 6 months,['FAMILY MEDICINE (624) ']
U-951 ,treatment heartburn associated non-erosive gastroesophageal reflux disease (gerd) 4 weeks,['GASTROENTEROLOGY (105) ']
U-1507 ,maintain healing ee relief heartburn,['FAMILY MEDICINE (624) ']
U-1552 ,healing grades erosive esophagitis (ee),['FAMILY MEDICINE (624) ']
U-1553 ,maintain healing ee relief heartburn,['FAMILY MEDICINE (624) ']
U-1554 ,treatment heartburn associated symptomatic non-erosive gastroesophageal disease (gerd),['GASTROENTEROLOGY (105) ']
U-1805 ,use dexlansoprazole patients taking clopidogrel without meaningful cyp2c19 interactions,['FAMILY MEDICINE (624) ']
U-1399 ,management nephropathic cystinosis administering total daily dose two divided doses,['FAMILY MEDICINE (624) ']
U-1384 ,method treating multiple sclerosis,['MUSCULOSKELETAL (109) ']
U-1385 ,method treating autoimmune disease selected autoimmune polyarthritis multiple sclerosis treating psoriatic arthritis,['MUSCULOSKELETAL (109) ']
U-2357 ,method treating attention deficit hyperactivity disorder (adhd),['PSYCHIATRY/PSYCHOLOGY (73) ']
U-839 ,treatment major depressive disorder (mdd),['PSYCHIATRY/PSYCHOLOGY (73) ']
U-2459 ,"treatment dyskinesia decreasing time patients parkinson's disease receiving levodopa-based therapy, without concomitant dopaminergic medications",['NEUROLOGY (189) ']
U-2105 ,"treatment dyskinesia patients parkinson's disease receiving immediate release levodopa-based therapy, without concomitant dopaminergic medications",['NEUROLOGY (189) ']
U-2106 ,"treatment dyskinesia patients parkinson's disease receiving levodopa-based therapy, without concomitant dopaminergic medications",['NEUROLOGY (189) ']
U-2224 ,"treatment dyskinesia increasing time without troublesome dyskinesia patients parkinson's disease receiving levodopa-based therapy, without concomitant dopaminergic medications",['NEUROLOGY (189) ']
U-2025 ,treatment attention deficit hyperactivity disorder,['PSYCHIATRY/PSYCHOLOGY (73) ']
U-539 ,treatment moderate severe dementia alzheimer's type,['NEUROLOGY (189) ']
U-1871 ,"treatment secondary hyperparathyroidism patients stage 3 4 chronic kidney disease using controlled release, oral 25-hydroxyvitamin",['NEPHROLOGY (88) ']
U-1872 ,use sustained release 25-hydroxyvitamin treating patients 25-hydroxyvitamin insufficiency deficiency,['ENDOCRINOLOGY (229) ']
U-1873 ,administration 25-hydroxyvitamin d3 controlled release,['FAMILY MEDICINE (624) ']
U-1888 ,use controlled release 25-hydroxyvitamin treating secondary hyperparathyroidism patients chronic kidney disease,['NEPHROLOGY (88) ']
U-1920 ,use extended release oral 25-hydroxyvitamin d3 treating secondary hyperparathyroidism adult patients chronic kidney disease stage 3 stage 4,['NEPHROLOGY (88) ']
U-2255 ,treating secondary hyperparathyroidism chronic kidney disease sustained release 25-hydroxyvitamin reduce patient's serum parathyroid hormone level sustained release least 10 hours,['NEPHROLOGY (88) ']
U-2256 ,"treating secondary hyperparathyroidism chronic kidney disease sustained release 25-hydroxyvitamin reduce patient's serum parathyroid hormone level cmax reduced compared bolus iv injection immediate-release, oral dosing",['NEPHROLOGY (88) ']
U-2257 ,"treating shpt ckd sustained release calcifediol reduce serum parathyroid hormone level change serum concentration calcifediol dose interval reduced compared bolus iv injection immediate-release, oral dosing",['ENDOCRINOLOGY (229) ']
U-2258 ,"treating secondary hyperparathyroidism ckd sustained release calcifediol reduce patient's serum parathyroid hormone level cmax24hr/c24hr reduced compared bolus iv injection immediate-release, oral dosing",['ENDOCRINOLOGY (229) ']
U-2259 ,"treating secondary hyperparathyroidism ckd sustained release calcifediol reduce patient's serum parathyroid hormone level tmax increased compared bolus iv injection immediate-release, oral dosing",['ENDOCRINOLOGY (229) ']
U-2274 ,"maintaining serum 25-hydroxyvitamin level least 30 ng/ml oral, sustained release 25-hydroxyvitamin",['FAMILY MEDICINE (624) ']
U-1645 ,"treatment parkinson's disease, post-encephalitic parkinsonism, parkinsonism may follow carbon monoxide intoxication manganese intoxication",['NEUROLOGY (189) ']
U-219 ,treatment parkinson's disease,['FAMILY MEDICINE (624) ']
U-1646 ,"treatment post-encephalitic parkinsonism, parkinsonism may follow carbon monoxide intoxication manganese intoxication",['FAMILY MEDICINE (624) ']
U-1647 ,treatment parkinsonism may follow carbon monoxide intoxication manganese intoxication,['FAMILY MEDICINE (624) ']
U-1649 ,treatment post-encephalitic parkinsonism,['FAMILY MEDICINE (624) ']
U-1720 ,method providing therapeutically effective stable median blood plasma level levodopa,['CARDIOLOGY/VASCULAR DISEASES (122) ']
U-1508 ,"management pain severe enough require daily, around-the-clock, long term opioid treatment orally administering plurality composite subunits claimed",['NEUROLOGY (189) ']
U-1556 ,"management pain severe enough require daily, around-the-clock, long-term opioid treatment alternative treatment options inadequate",['NEUROLOGY (189) ']
U-2293 ,"use combination dexamethasone adults prevention acute delayed nausea vomiting associated initial repeat courses cancer chemotherapy, including, limited to, highly emetogenic chemotherapy",['ONCOLOGY (263) ']
U-717 ,method relieving preventing constipation human constipated patient,['GASTROENTEROLOGY (105) ']
U-1392 ,method relieving preventing constipation human patient opioid-induced constipation,['GASTROENTEROLOGY (105) ']
U-1391 ,method treating opioid-induced constipation,['GASTROENTEROLOGY (105) ']
U-739 ,method treating constipation opening cic channels mammalian subject,['GASTROENTEROLOGY (105) ']
U-1404 ,method treating constipation patient opioid-induced constipation opening cic channels,['GASTROENTEROLOGY (105) ']
U-1203 ,method relieving treating constipation human constipated patient,['GASTROENTEROLOGY (105) ']
U-1393 ,method relieving treating constipation patient opioid-induced constipation,['GASTROENTEROLOGY (105) ']
U-1214 ,method relieving constipation human patient comprises administering patient dosage unit comprising (i) 24mcg+/- 10% drug substance (ii) pharmaceutically suitable excipient,['ENDOCRINOLOGY (229) ']
U-1394 ,method relieving constipation patient opioid-induced constipation comprises administering patient dosage unit comprising(i)24microg+/- 10% drug substance (ii) pharmaceutically suitable excipient,['GASTROENTEROLOGY (105) ']
U-1345 ,use relieving preventing constipation human patient dosage unit comprising 24microg+/- 10% drug substance pharmaceutically suitable excipient,['GASTROENTEROLOGY (105) ']
U-1395 ,use relieving preventing constipation patient opioid-induced constipation dosage unit comprising 24microg +/- 10% drug substance pharmaceutically suitable excipient,['GASTROENTEROLOGY (105) ']
U-1520 ,method long term treatment chronic constipation human subject,['FAMILY MEDICINE (624) ']
U-874 ,method treating constipation patient irritable bowel syndrome,['GASTROENTEROLOGY (105) ']
U-873 ,method treating constipation patient irritable bowel syndrome opening chloride channels (cic),['GASTROENTEROLOGY (105) ']
U-1085 ,method treating irritable bowel syndrome method treating abdominal discomfort associated irritable bowel syndrome,['GASTROENTEROLOGY (105) ']
U-1202 ,method relieving treating constipation patient irritable bowel syndrome,['GASTROENTEROLOGY (105) ']
U-1519 ,method long term treatment chronic constipation human subject irritable bowel syndrome,['FAMILY MEDICINE (624) ']
U-1167 ,prophylaxis deep vein thrombosis (dvt),['HEMATOLOGY (135) ']
U-1502 ,prophylaxis pulmonary embolism,['PULMONARY/RESPIRATORY DISEASES (135) ']
U-2029 ,preventing condition characterized undesired thrombosis,['HEMATOLOGY (135) ']
U-2030 ,prophylaxis venous thrombosis,['HEMATOLOGY (135) ']
U-2034 ,inhibiting coagulation,['FAMILY MEDICINE (624) ']
U-2035 ,prophylaxis venous thromboembolism,['FAMILY MEDICINE (624) ']
U-2439 ,"treatment menopause symptoms, including vasomotor symptoms",['FAMILY MEDICINE (624) ']
U-2335 ,treatment melanoma,['FAMILY MEDICINE (624) ']
U-2336 ,treatment melanoma mediated b-raf protein kinase,['FAMILY MEDICINE (624) ']
U-2337 ,indicated combination binimetinib treatment melanoma braf mutation,['ONCOLOGY (263) ']
U-2334 ,treatment melanoma braf mutation,['DERMATOLOGY (109) ']
U-2145 ,treatment adult patients mantle cell lymphoma received least one prior therapy,['ONCOLOGY (263) ']
U-1571 ,treatment gaucher disease type 1,['FAMILY MEDICINE (624) ']
U-1617 ,method treating medullary thyroid cancer,['ONCOLOGY (263) ']
U-2412 ,treatment patients chronic lymphocytic leukemia (cll) and/or small lymphocytic leukemia (sll),['ONCOLOGY (263) ']
U-2413 ,treatment patients follicular lymphoma (fl),['HEMATOLOGY (135) ']
U-901 ,prevention postoperative nausea vomiting,['ONCOLOGY (263) ']
U-1743 ,prevention nausea vomiting associated chemotherapy,['ONCOLOGY (263) ']
U-2447 ,treatment severe hypertriglyceridemia (500 mg/dl) adult patients adjunct diet,['FAMILY MEDICINE (624) ']
U-1511 ,treatment hypertriglyceridemia,['FAMILY MEDICINE (624) ']
U-1600 ,dosage modification following elevated liver enzymes treatment idiopathic pulmonary fibrosis,['PULMONARY/RESPIRATORY DISEASES (135) ']
U-1609 ,continued dosing dosage modification following elevated liver enzymes treatment idiopathic pulmonary fibrosis,['PULMONARY/RESPIRATORY DISEASES (135) ']
U-1601 ,dose escalation 14 days treatment idiopathic pulmonary fibrosis,['PULMONARY/RESPIRATORY DISEASES (135) ']
U-1602 ,method administering pirfenidone capsules treat fibrotic condition,['FAMILY MEDICINE (624) ']
U-1603 ,method administering pirfenidone reduce drug interactions fluvoxamine,['FAMILY MEDICINE (624) ']
U-1604 ,method administering pirfenidone reduce drug interactions strong inhibitor cyp1a2,['FAMILY MEDICINE (624) ']
U-1605 ,method administering pirfenidone avoid reduced efficacy discontinuing smoking discontinuing avoiding another strong cyp1a2 inducer,['PSYCHIATRY/PSYCHOLOGY (73) ']
U-1606 ,method administering pirfenidone avoiding discontinuing concomitant use moderate strong inhibitor cyp1a2 another cyp enzyme involved pirfenidone metabolism,['FAMILY MEDICINE (624) ']
U-1607 ,method administering dosage form includes granulate formulation pirfenidone treat fibrotic condition,['FAMILY MEDICINE (624) ']
U-2361 ,"method administering granulate formulation 5-methyl-1-phenyl-2-(1h)-pyridone recited claim 1, treat idiopathic pulmonary fibrosis",['PULMONARY/RESPIRATORY DISEASES (135) ']
U-1608 ,dose escalation 14 days treatment fibrosis condition,['FAMILY MEDICINE (624) ']
U-1610 ,continued dosing dosage modification following elvated liver enzymes use pirfenidone,['FAMILY MEDICINE (624) ']
U-1611 ,method administering pirfenidone avoid reduced efficacy discontinuing smoking discontinuing strong cyp1a2 inducer,['PSYCHIATRY/PSYCHOLOGY (73) ']
U-1612 ,method administering pirfenidone avoid reduced efficacy avoiding smoking avoiding another strong cyp1a2 inducer,['PSYCHIATRY/PSYCHOLOGY (73) ']
U-1613 ,dosage modification treatment pirfenidone reduce drug interactions ciprofloxacin,['FAMILY MEDICINE (624) ']
U-1669 ,"treatment multiple myeloma, combination bortezomib dexamethasone",['FAMILY MEDICINE (624) ']
U-2371 ,treatment fabry patients,['FAMILY MEDICINE (624) ']
U-2372 ,method reducing left ventricular mass index (lvmi) fabry patient administering migalastat,['FAMILY MEDICINE (624) ']
U-2373 ,method reducing podocyte globotriaosylceramide (gl-3) fabry patient administering migalastat,['FAMILY MEDICINE (624) ']
U-1086 ,treatment autoimmune disease,['FAMILY MEDICINE (624) ']
U-2315 ,treatment multiple sclerosis pediatric patient population 0.25 mg fingolimod,['FAMILY MEDICINE (624) ']
U-2477 ,treatment non-24 hour sleep-wake disorder avoiding use tasimelteon combination cyp1a2 strong inhibitors,['NEUROLOGY (189) ']
U-2149 ,treatment non-24 hour sleep-wake disorder administering tasimelteon,['NEUROLOGY (189) ']
U-1710 ,treatment non-24-hour sleep-wake disorder avoiding use tasimelteon combination fluvoxamine,['NEUROLOGY (189) ']
U-1934 ,treatment non-24-hour sleep-wake disorder avoiding use tasimelteon combination strong cyp1a2 inhibitor,['NEUROLOGY (189) ']
U-1486 ,treatment non-24-hour sleep-wake disorder,['NEUROLOGY (189) ']
U-2085 ,treatment non-24-hour sleep-wake disorder avoiding use tasimelteon combination rifampin,['NEUROLOGY (189) ']
U-2147 ,treatment non-24 hour sleep-wake disorder orally administering 20mg tasimelteon daily bedtime,['NEUROLOGY (189) ']
U-1998 ,"treating hr-pos., her2-neg. advanced metastatic breast cancer palbociclib combo aromatase inhibitor initial endocrine based therapy postmenopausal women fulvestrant women disease progression endocrine therapy",['OBSTETRICS/GYNECOLOGY (WOMEN’S HEALTH) (120) ']
U-1684 ,treatment chronic lymphocytic leukemia,['ONCOLOGY (263) ']
U-1946 ,treatment small lymphocytic lymphoma,['ONCOLOGY (263) ']
U-2241 ,treatment small lymphocytic lymphoma 17p deletion,['ONCOLOGY (263) ']
U-2242 ,treatment chronic lymphocytic leukemia 17p deletion,['ONCOLOGY (263) ']
U-1650 ,treatment waldenstrom's macroglobulinemia,['FAMILY MEDICINE (624) ']
U-1456 ,treatment mantle cell lymphoma,['HEMATOLOGY (135) ']
U-1947 ,treatment marginal zone lymphoma,['HEMATOLOGY (135) ']
U-1491 ,treatment chronic lymphocytic leukemia,['ONCOLOGY (263) ']
U-2219 ,treatment chronic small lymphocytic leukemia,['ONCOLOGY (263) ']
U-1683 ,treatment chronic lymphocytic leukemia 17p deletion,['ONCOLOGY (263) ']
U-1745 ,treatment patients waldenstrom's macroglobulinemia,['FAMILY MEDICINE (624) ']
U-2150 ,treatment chronic graft-versus-host disease,['FAMILY MEDICINE (624) ']
U-2159 ,treatment chronic lymphocytic leukemia/small lymphocytic lymphoma,['ONCOLOGY (263) ']
U-2228 ,treatment small lymphocytic leukemia,['ONCOLOGY (263) ']
U-1995 ,treatment tardive dyskinesia,['NEUROLOGY (189) ']
U-1316 ,dosing regimen treatment hypercholesterolemia hyperlipidemia patients homozygous familial hypercholesterolemia using least three step-wise increasing doses,['CARDIOLOGY/VASCULAR DISEASES (122) ']
U-1317 ,"treatment hypercholesterolemia, hyperlipidemia hyperlipoproteinemia patients homozygous familial hypercholesterolemia",['CARDIOLOGY/VASCULAR DISEASES (122) ']
U-1318 ,treatment hypercholesterolemia decreasing amount activity microsomal triglyceride transfer protein patients homozygous familial hypercholesterolemia,['GENETIC DISEASE (61) ']
U-1851 ,dosing regimen treatment hypercholesterolemia hyperlipidemia patients homozygous familial hypercholesterolemia using least three step-wise increasing doses,['CARDIOLOGY/VASCULAR DISEASES (122) ']
U-1695 ,method treating thyroid carcinoma including differentiated thyroid cancer,['ONCOLOGY (263) ']
U-1278 ,method treating irritable bowel syndrome constipation adults,['GASTROENTEROLOGY (105) ']
U-1516 ,method treating chronic idiopathic constipation adult patients.,['GASTROENTEROLOGY (105) ']
U-1515 ,method treating irritable bowel syndrome constipation adult patients.,['FAMILY MEDICINE (624) ']
U-1634 ,treatment brca mutated ovarian cancer using parp inhibitor,['ONCOLOGY (263) ']
U-2434 ,use combination lenalidomide dexamethasone treatment patients multiple myeloma received least one prior therapy,['FAMILY MEDICINE (624) ']
U-1843 ,treatment psychosis,['FAMILY MEDICINE (624) ']
U-1844 ,treatment parkinson's disease psychosis,['NEUROLOGY (189) ']
U-1845 ,treatment psychosis symptom thereof,['FAMILY MEDICINE (624) ']
U-1846 ,treatment neurodegenerative disease symptom thereof,['FAMILY MEDICINE (624) ']
U-1974 ,treatment hallucinations delusions associated parkinson's disease psychosis,['NEUROLOGY (189) ']
U-1722 ,treatment basal cell carcinoma,['ONCOLOGY (263) ']
U-1677 ,treatment idiopathic pulmonary fibrosis (ipf),['PULMONARY/RESPIRATORY DISEASES (135) ']
U-1467 ,method treating hepatitis c,['IMMUNOLOGY (216) ']
U-1361 ,use pomalidomide preventing exposure fetus contraindicated individual pomalidomide,['FAMILY MEDICINE (624) ']
U-1360 ,use pomalidomide treatment multiple myeloma,['FAMILY MEDICINE (624) ']
U-2254 ,use pomalidomide dexamethasone patients multiple myeloma least two prior therapies including lenalidomide proteasome inhibitor demonstrated disease progression within 60 days completing last therapy,['HEMATOLOGY (135) ']
U-1931 ,prophylaxis treatment venous arterial thrombotic disease,['FAMILY MEDICINE (624) ']
U-1759 ,method reversing anticoagulant effect dabigatran using idarucizumab,['FAMILY MEDICINE (624) ']
U-1210 ,use revlimid (lenalidomide) preventing exposure fetus contraindicated individual revlimid (lenalidomide),['FAMILY MEDICINE (624) ']
U-1982 ,use revlimid (lenalidomide) treatment patients transfusion-dependent anemia due low-or intermediate-1-risk myelodysplastic syndromes associated deletion 5q abnormality without additional cytogenetic abnormalities,['HEMATOLOGY (135) ']
U-1983 ,"use revlimid (lenalidomide) treatment patients mantle cell lymphoma whose disease relapsed progressed two prior therapies, one included bortezomib",['HEMATOLOGY (135) ']
U-1984 ,"use revlimid (lenalidomide) treatment patients multiple myeloma, combination dexamethasone",['FAMILY MEDICINE (624) ']
U-1249 ,treatment male patient disease condition responsive teratogenic drug,['FAMILY MEDICINE (624) ']
U-1985 ,"use revlimid (lenalidomide) treatment patients multiple myeloma, maintenance following autologous hematopoietic stem cell transplantation (auto-hsct)",['ONCOLOGY (263) ']
U-1986 ,"use revlimid (lenalidomide) treatment patients multiple myeloma, combination dexamethasone, wherein patients received previous treatment multiple myeloma",['FAMILY MEDICINE (624) ']
U-2007 ,"treatment adult patients newly diagnosed acute myeloid leukemia (aml) flt3 mutation-positive, combination standard cytarabine daunorubicin induction cytarabine consolidation chemotherapy",['ONCOLOGY (263) ']
U-2008 ,"treatment adult patients aggressive systemic mastocytosis (asm), systemic mastocytosis associated hematological neoplasm (sm-ahn), mast cell leukemia (mcl)",['ONCOLOGY (263) ']
U-1154 ,"treatment protein kinase related disorders, gastrointestinal stromal tumors, renal cell carcinoma advanced pancreatic neuroendocrine tumors, sunitinib",['ONCOLOGY (263) ']
U-2171 ,adjuvant treatment adult patients high risk recurrent rcc following nephrectomy,['FAMILY MEDICINE (624) ']
U-883 ,treatment gastrointestinal stromal tumor sunitinib,['GASTROENTEROLOGY (105) ']
U-1406 ,treatment melanoma,['FAMILY MEDICINE (624) ']
U-2031 ,tafinlar indicated single agent treatment patients unresectable metastatic melanoma braf v600e mutation detected fda-approved test,['ONCOLOGY (263) ']
U-2032 ,"tafinlar indicated, combination trametinib, treatment patients unresectable metastatic melanoma braf v600e v600k mutations, detected fda-approved test.",['DERMATOLOGY (109) ']
U-2296 ,"tafinlar indicated, combination trametinib, adjuvant treatment patients melanoma braf v600e v600k mutations, detected fda-approved test, involvement lymph node(s), following complete resection",['DERMATOLOGY (109) ']
U-1713 ,tafinlar combination trametinib treatment patients unresectable metastatic melanoma,['ONCOLOGY (263) ']
U-2297 ,improvement glycemic control type 2 diabetes patients administering starting dose 10 mcg 14 days increasing maintenance dose 20 mcg day 15,['ENDOCRINOLOGY (229) ']
U-2298 ,"tafinlar indicated, combination trametinib, treatment patients locally advanced metastatic anaplastic thyroid cancer (atc) braf v600e mutation satisfactory locoregional treatment options",['ONCOLOGY (263) ']
U-2026 ,"tafinlar(r) indicated, combination trametinib, treatment patients unresectable metastatic melanoma braf v600e v600k mutations, detected fda-approved test.",['DERMATOLOGY (109) ']
U-2027 ,"tafinlar(r) indicated, combination trametinib, treatment patients metastatic non-small cell lung cancer (nsclc) braf v600e mutation detected fda-approved test.",['ONCOLOGY (263) ']
U-1811 ,treatment patients unresectable metastatic melanoma braf v600e mutations confirming presence braf v600e mutation,['DERMATOLOGY (109) ']
U-836 ,method treatment leukemias,['FAMILY MEDICINE (624) ']
U-1374 ,treatment philadelphia chromosome positive chronic myeloid leukemia (ph+cml),['ONCOLOGY (263) ']
U-1407 ,treatment newly diagnosed philadelphia chromosome positive chronic myeloid leukemia (ph + cml),['ONCOLOGY (263) ']
U-2346 ,treatment human smallpox disease caused variola virus adults pediatric patients weighing least 13 kg,['IMMUNOLOGY (216) ']
U-2472 ,"method treating neuroblastoma, glioma, thyroid, breast cancer solid tumors exhibit ntrk gene fusion",['ONCOLOGY (263) ']
U-2474 ,method treating solid tumors exhibit ntrk gene fusion surgical resection,['ONCOLOGY (263) ']
U-2469 ,method treating cancerous solid tumors,['ONCOLOGY (263) ']
U-2470 ,method treating solid tumors exhibit ntrk gene fusion,['ONCOLOGY (263) ']
U-2475 ,method treating solid tumors exhibit ntrk gene fusion pediatric patient,['ONCOLOGY (263) ']
U-2160 ,management osteoarthritis pain administering 5 mg meloxicam,['NEUROLOGY (189) ']
U-2165 ,management osteoarthritis pain administering 10 mg meloxicam,['NEUROLOGY (189) ']
U-1750 ,treatment schizophrenia and/or acute manic mixed episodes associated bipolar disorder cariprazine,['PSYCHIATRY/PSYCHOLOGY (73) ']
U-727 ,treatment attention deficit hyperactivity disorder (adhd),['PSYCHIATRY/PSYCHOLOGY (73) ']
U-1034 ,treatment attention deficit hyperactivity disorder (adhd) adults,['PSYCHIATRY/PSYCHOLOGY (73) ']
U-842 ,indicated treatment attention-deficit/hyperactivity disorder (adhd),['PSYCHIATRY/PSYCHOLOGY (73) ']
U-1179 ,treatment cancer mediated anaplastic lymphoma kinase (alk),['ONCOLOGY (263) ']
U-1281 ,treatment patients metastatic castration-resistant prostate cancer previously received docetaxel,['ONCOLOGY (263) ']
U-1588 ,treatment patients metastatic castration-resistant prostate cancer (crpc).,['FAMILY MEDICINE (624) ']
U-2345 ,treatment patients castration-resistant prostate cancer (crpc),['FAMILY MEDICINE (624) ']
U-88 ,treatment moderate plaque psoriasis,['DERMATOLOGY (109) ']
U-193 ,psoriasis,['DERMATOLOGY (109) ']
U-742 ,twice daily topical treatment moderate severe plaque psoriasis.,['DERMATOLOGY (109) ']
U-1408 ,treatment plaque psoriasis patients 18 years age older,['DERMATOLOGY (109) ']
U-1858 ,treatment plaque psoriasis,['DERMATOLOGY (109) ']
U-540 ,treatment fungal infections,['INFECTIONS AND INFECTIOUS DISEASES (211) ']
U-1959 ,topical treatment persistent facial erythema associated rosacea adults 1% oxymetazoline hydrochloride cream,['DERMATOLOGY (109) ']
U-2306 ,daily topical treatment persistent facial erythema associated rosacea adults 1% oxymetazoline hydrochloride cream,['DERMATOLOGY (109) ']
U-805 ,treatment impetigo due staphylococcus aureus streptococcus pyogenes,['DERMATOLOGY (109) ']
U-2366 ,treatment liver disease nutrition patients age 12,['FAMILY MEDICINE (624) ']
U-2367 ,use patients parenteral nutrition associated cholestasis parenteral nutrition associated liver disease,['NEUROLOGY (189) ']
U-1741 ,prevention delayed nausea vomiting associated emetogenic cancer chemotherapy,['ONCOLOGY (263) ']
U-1769 ,treatement pain transmucosal delivery buprenorphine,['NEUROLOGY (189) ']
U-1087 ,detection non-muscle invasive papillary cancer bladder photodynamic cystoscopy,['ONCOLOGY (263) ']
U-2250 ,detection carcinoma bladder photodynamic cystoscopy,['ONCOLOGY (263) ']
U-2220 ,method diagnosis adult growth hormone deficiency measuring level growth hormone oral administration macimorelin,['ENDOCRINOLOGY (229) ']
U-2310 ,cleansing colon preparation colonoscopy adults,['NEUROLOGY (189) ']
U-2095 ,mitosol antimetabolite indicated adjunct ab externo glaucoma surgery. intended topical application site glaucoma filtration surgery,['OPHTHALMOLOGY (56) ']
U-2151 ,method treating pain inflammation injectable controlled sustained release formulation triamcinolone acetonide,['NEUROLOGY (189) ']
U-543 ,treatment schizophrenia,['PSYCHIATRY/PSYCHOLOGY (73) ']
U-1632 ,"treatment schizophrenia, efficacy treating acute episodes schizophrenia",['PSYCHIATRY/PSYCHOLOGY (73) ']
U-1633 ,use aripiprazole extended release injectable suspension treating acute episodes schizophrenia,['FAMILY MEDICINE (624) ']
U-1530 ,use aripiprazole extended release injectable suspension,['ENDOCRINOLOGY (229) ']
U-493 ,treatment type 2 diabetes mellitus,['ENDOCRINOLOGY (229) ']
U-2139 ,treatment type 2 diabetes mellitus combination exenatide,['ENDOCRINOLOGY (229) ']
