 Use Code,Use,TreatmentTherapeutic_Area
U-654 ,"lowering plasma glucagon subject need thereof, including one type 2 diabetes, administering exendin analog, exendin-4",['ENDOCRINOLOGY (229) ']
U-2288 ,treatment type 2 diabetes mellitus exenatide add-on basil insulin basal insulin plus metformin therapy,['ENDOCRINOLOGY (229) ']
U-1223 ,method treating type 2 diabetes using sustained-release composition containing exenatide,['ENDOCRINOLOGY (229) ']
U-1313 ,adjunct diet exercise improve glycemic control adults type 2 diabetes mellitus,['ENDOCRINOLOGY (229) ']
U-412 ,treatment type 2 diabetes,['FAMILY MEDICINE (624) ']
U-1522 ,"treatment type 2 diabetes mellitus patient, wherein glycemic control (hba1c < 7.0%) achievable using one insulin, metformin, pioglitazone, rosiglitazone",['ENDOCRINOLOGY (229) ']
U-2154 ,reducing fasting plasma glucose human need thereof using sustained-release composition containing exendin-4,['FAMILY MEDICINE (624) ']
U-2155 ,reducing body weight human need thereof using sustained-release composition containing exendin-4,['FAMILY MEDICINE (624) ']
U-2156 ,reducing hba1c human need thereof using sustained-release composition containing exendin-4,['FAMILY MEDICINE (624) ']
U-2363 ,administration risperidone,['FAMILY MEDICINE (624) ']
U-1629 ,method treating acromegaly,['ENDOCRINOLOGY (229) ']
U-1546 ,use treatment malignant hyperthermia conjunction appropriate supportive measures prevention malignant hyperthermia patients high risk.,['FAMILY MEDICINE (624) ']
U-1434 ,treatment pancreatic cancer,['ONCOLOGY (263) ']
U-1092 ,treatment breast cancer,['ONCOLOGY (263) ']
U-1290 ,treatment lung cancer,['FAMILY MEDICINE (624) ']
U-1117 ,treatment breast cancer,['ONCOLOGY (263) ']
U-1916 ,prevention nausea vomiting associated chemotherapy (cinv),['ONCOLOGY (263) ']
U-2312 ,treatment hyperkalemia adults,['FAMILY MEDICINE (624) ']
U-1736 ,treatment thrombocytopenia adult pediatric patients 1 year older chronic immune (idiopathic) thrombocytopenia (itp),['HEMATOLOGY (135) ']
U-1286 ,method reducing risk pulmonary edema patients need treatment inhaled nitric oxide,['FAMILY MEDICINE (624) ']
U-1226 ,method providing predetermined concentration nitric oxide patient,['FAMILY MEDICINE (624) ']
U-1453 ,method treating hypoxic respiratory failure verifying gas information nitric oxide prior delivery patient,['PEDIATRICS/NEONATOLOGY (124) ']
U-1824 ,method providing nitric oxide therapy patient verifying gas information nitric oxide prior delivery patient,['FAMILY MEDICINE (624) ']
U-1823 ,method providing nitric oxide therapy patient compensating long-term sensitivity drift electrochemical gas sensors used systems delivering therapeutic nitric oxide patient,['FAMILY MEDICINE (624) ']
U-2148 ,method providing nitric oxide therapy patient measuring displaying indication calculated delivery concentration nitiric oxide compared desired delivery concentration nitric oxide,['FAMILY MEDICINE (624) ']
U-1033 ,topical treatment acne vulgaris,['FAMILY MEDICINE (624) ']
U-804 ,treatment actinic keratoses photodynamic therapy,['FAMILY MEDICINE (624) ']
U-1078 ,treatment acne,['FAMILY MEDICINE (624) ']
U-1222 ,inhibit proliferative activity neoplastic cells,['FAMILY MEDICINE (624) ']
U-1440 ,use ingenol mebutate treat actinic keratosis,['ONCOLOGY (263) ']
U-2138 ,topical treatment actinic keratosis face scalp using one treatment course ingenol mebutate,['FAMILY MEDICINE (624) ']
U-1427 ,alkylating drug indicated topical treatment stage ia ib mycosis fungoides-type cutaneous t-cell lymphoma patients received prior skin directed therapy,['ONCOLOGY (263) ']
U-1311 ,method treating cystic fibrosis,"['HEPATOLOGY (LIVER, PANCREATIC, GALL BLADDER) (54) ']"
U-1906 ,"method treating patient cystic fibrosis, patient g551d mutation cftr, using n-(5-hydroxy-2,4-di-tert-butyl-phenyl)-4-oxo-1h-quinoline-3-carboxamide","['HEPATOLOGY (LIVER, PANCREATIC, GALL BLADDER) (54) ']"
U-1905 ,"method treating patient cystic fibrosis, patient r117h mutation cftr, using n-(5-hydroxy-2,4-di-tert-butyl-phenyl)-4-oxo-1h-quinoline-3-carboxamide","['HEPATOLOGY (LIVER, PANCREATIC, GALL BLADDER) (54) ']"
U-2234 ,use ivacaftor treating cystic fibrosis patient mild moderate cf phenotype least one mutation cftr gene responsive ivacaftor based clinical and/or vitro assay data,['PULMONARY/RESPIRATORY DISEASES (135) ']
U-2374 ,treatment cystic fibrosis patient age 2-5 years homozygous f508del mutation cftr gene using lumacaftor ivacaftor,"['HEPATOLOGY (LIVER, PANCREATIC, GALL BLADDER) (54) ']"
U-2396 ,treatment cystic fibrosis patient age 2-5 years homozygous f508del mutation cftr gene using dosage unit comprising lumacaftor recited claim 1 us patent 8716338 ivacaftor,"['HEPATOLOGY (LIVER, PANCREATIC, GALL BLADDER) (54) ']"
U-2375 ,treatment cystic fibrosis patient age 2-5 years homozygous f508del mutation cftr gene using lumacaftor form ivacaftor,"['HEPATOLOGY (LIVER, PANCREATIC, GALL BLADDER) (54) ']"
U-2397 ,treatment cystic fibrosis patient age 2-5 years homozygous f508del mutation cftr gene using dosage unit comprising lumacaftor ivacaftor recited claim 1 us patent 9192606,"['HEPATOLOGY (LIVER, PANCREATIC, GALL BLADDER) (54) ']"
U-2376 ,treatment cystic fibrosis patient age 2-5 years homozygous f508del mutation cftr gene using lumacaftor solid composition comprising amorphous less 30% crystalline ivacaftor,"['HEPATOLOGY (LIVER, PANCREATIC, GALL BLADDER) (54) ']"
U-1791 ,"emergency treatment adult & pediatric patients following fluorouracil capecitabine overdose,or exhibit early-onset,severe life-threatening cardiac cns toxicity unusually severe adverse reactions within 96 hours",['NEUROLOGY (189) ']
U-1878 ,opioid dependence,['NEUROLOGY (189) ']
U-2272 ,treatment nasal polyps patients >=18 years age ethmoid sinus surgery using corticosteroid-eluting (mometasone furoate) implant,['FAMILY MEDICINE (624) ']
U-708 ,treatment chronic non-infectious uveitis affecting posterior segment eye,['FAMILY MEDICINE (624) ']
U-1271 ,treatment adult patients philadelphia chromosome-negative(ph-) acute lymphoblastic leukemia (all) second greater relapse whose disease progressed following two anti-leukemia therapies,['ONCOLOGY (263) ']
U-1848 ,"treatment metastatic adenocarcinoma pancreas progressed gemcitabine-based therapy, combination 5-fluorouracil leucovorin",['ONCOLOGY (263) ']
U-1856 ,"treatment metastatic adenocarcinoma pancreas progressed gemcitabine-based therapy, combination 5-fluorouracil leucovorin, patient homozygous ugt1a1*28 allele",['ONCOLOGY (263) ']
U-1899 ,"treatment pancreatic cancer progressed gemcitabine-based therapy, combination 5-fluorouracil leucovorin",['ONCOLOGY (263) ']
U-1917 ,"treatment exocrine pancreatic cancer progressed gemcitabine-based therapy, combination 5-fluorouracil leucovorin",['ONCOLOGY (263) ']
U-2091 ,"treatment metastatic adenocarcinoma pancreas progressed gemcitabine-based therapy, combination 5-fluorouracil leucovorin, patient homozygous ugt1a1*28 allele",['ONCOLOGY (263) ']
U-1792 ,treatment otic infection inflammation,['FAMILY MEDICINE (624) ']
U-1793 ,treatment pediatric patients otitis media effusion undergoing tympanostomy tube placement,['FAMILY MEDICINE (624) ']
U-2252 ,treatment acute otitis externa patients 6 months age older due pseudomonas aeruginosa staphylococcus aureus,['FAMILY MEDICINE (624) ']
U-967 ,"method reversing soft-tissue anesthesia i.e. anesthesia lip tongue, associated functional deficits resulting intraoral submucosal injection local anesthetic",['NEUROLOGY (189) ']
U-764 ,treatment schizophrenia,['PSYCHIATRY/PSYCHOLOGY (73) ']
U-596 ,treatment hormone receptor positive metastatic breast cancer postmenopausal women disease progression following antiestrogen therapy,['ONCOLOGY (263) ']
U-1826 ,"treatment hr-positive, human epidermal growth factor receptor 2 (her2)-negative advanced metastatic breast cancer combination palbociclib women disease progression endocrine therapy",['ONCOLOGY (263) ']
U-2108 ,treatment hormone receptor positive her2-negative advanced breast cancer postmenopausal women previously treated endocrine therapy,['ONCOLOGY (263) ']
U-2163 ,"treatment hr-positive, human epidermal growth factor receptor 2 (her-2)-negative advanced metastatic breast cancer combination palbociclib abemaciclib women disease progression endocrine therapy",['ONCOLOGY (263) ']
U-336 ,diagnostic radioimaging,['FAMILY MEDICINE (624) ']
U-1187 ,treatment pathological state antagonizing bradykinin receptor including treatment acute attacks hereditary angioedema (hae),['FAMILY MEDICINE (624) ']
U-1891 ,treatment prevention nausea vomiting,['ONCOLOGY (263) ']
U-2253 ,"prophylactic treatment nausea vomiting, including prevention acute delayed nausea vomiting associated chemotherapy",['ONCOLOGY (263) ']
U-2316 ,treatment dyspareunia,['FAMILY MEDICINE (624) ']
U-2317 ,treatment symptom vulvar vaginal atrophy,['OBSTETRICS/GYNECOLOGY (WOMEN’S HEALTH) (120) ']
U-1922 ,"intravaginal prasterone (dehydroepiandrosterone) daily dose 6.5mg treatment dyspareunia, symptom vulvar vaginal atrophy, due menopause",['OBSTETRICS/GYNECOLOGY (WOMEN’S HEALTH) (120) ']
U-2003 ,"method positioning intrauterine system holding inserter handle one hand, advancing inserter cervix uterus, retracting slider handle release intrauterine system",['OBSTETRICS/GYNECOLOGY (WOMEN’S HEALTH) (120) ']
U-2348 ,method prevention pregnancy,['OBSTETRICS/GYNECOLOGY (WOMEN’S HEALTH) (120) ']
U-1816 ,treatment urea cycle disorder,['PSYCHIATRY/PSYCHOLOGY (73) ']
U-1383 ,dosage adjustment nitrogen scavenging drug treatment urea cycle disorder,['PSYCHIATRY/PSYCHOLOGY (73) ']
U-835 ,relief inflammatory pruritic manifestations atopic dermatitis patients one year age older,['FAMILY MEDICINE (624) ']
U-1775 ,use lotion containing halobetasol propionate treatment corticosteroid-responsive dermatoses including psoriasis,['DERMATOLOGY (109) ']
U-1932 ,method treating mild moderate atopic dermatitis.,['FAMILY MEDICINE (624) ']
U-2267 ,method relieving pain associated post-herpetic neuralgia,['NEUROLOGY (189) ']
U-645 ,treatment asthma,['FAMILY MEDICINE (624) ']
U-1476 ,"indicated long-term, once-daily, maintenance treatment airflow obstruction patients chronic obstructive pulmonary disease (copd), including chronic bronchitis and/or emphysema.",['PULMONARY/RESPIRATORY DISEASES (135) ']
U-1559 ,indicated once-daily maintenance treatment asthma prophylactic therapy patients aged 12 years age older,['PULMONARY/RESPIRATORY DISEASES (135) ']
U-2349 ,once-daily maintenance treatment asthma prophylactic therapy patients aged 5 years older,['FAMILY MEDICINE (624) ']
U-1401 ,"indicated long-term, once-daily maintenance treatment airflow obstruction pts copd, including chronic bronchitis and/or emphysema, also reduce exacerbations copd pts history exacerbations",['PULMONARY/RESPIRATORY DISEASES (135) ']
U-1691 ,indicated once-daily inhaled treatment asthma adults aged 18 years older,['FAMILY MEDICINE (624) ']
U-2099 ,"indicated long-term, once-daily, maintenance treatment airflow obstruction patients chronic obstructive pulmonary disease (copd), including bronchitis and/or emphysema",['PULMONARY/RESPIRATORY DISEASES (135) ']
U-2100 ,indicated once-daily treatment asthma patients 18 years older,['FAMILY MEDICINE (624) ']
U-1424 ,"long-term, daily maintenance treatment airflow obstruction pts copd, including chronic bronchitis and/or emphysema, also reduce exacerbations copd patients history exacerbations",['PULMONARY/RESPIRATORY DISEASES (135) ']
U-1548 ,"long-term, once-daily maintenance treatment airflow obstruction patients copd, including chronic bronchitis and/or emphysema, also reduce exacerbations copd patients history exacerbations",['PULMONARY/RESPIRATORY DISEASES (135) ']
U-1773 ,long - term maintenance treatment airflow obstruction patients chronic obstructive pulmonary disease (copd),['PULMONARY/RESPIRATORY DISEASES (135) ']
U-2125 ,treatment inflammatory disorder respiratory tract once-per-day administration pharmaceutical formulation comprising fluticasone furoate long-acting beta2 adrenoreceptor agonist,['FAMILY MEDICINE (624) ']
U-2134 ,treatment chronic obstructive pulmonary disease once-per-day administration pharmaceutical formulation comprising fluticasone furoate long-acting beta2 adrenoreceptor,['FAMILY MEDICINE (624) ']
U-2126 ,"use fluticasone furoate treatment inflammatory allergic conditions, including chronic obstructive pulmonary disease",['PULMONARY/RESPIRATORY DISEASES (135) ']
U-2127 ,"indicated long-term, once-daily, maintenance treatment patients chronic obstructive pulmonary disease (copd), including chronic bronchitis and/or emphysema",['PULMONARY/RESPIRATORY DISEASES (135) ']
U-2128 ,"method inhibiting binding acetylcholine acetylcholine receptor respiratory tract human, comprising contacting receptor effective amount umeclidinium, via inhalation",['FAMILY MEDICINE (624) ']
U-2129 ,"method inhibiting binding acetylcholine acetylcholine receptor respiratory tract human, comprising contacting receptor effective amount umeclidinium, via topical application",['FAMILY MEDICINE (624) ']
U-2301 ,use combination dexamethasone adults prevention acute delayed nausea vomiting associated initial repeat courses highly emetogenic cancer chemotherapy,['ONCOLOGY (263) ']
U-2124 ,treatment adult patients relapsed follicular lymphoma received least two prior systemic therapies,['HEMATOLOGY (135) ']
U-2028 ,treatment acute bacterial skin skin structure infections caused designated susceptible bacteria adults,['INFECTIONS AND INFECTIOUS DISEASES (211) ']
U-1544 ,treatment patients relapsed refractory peripheral t-cell lymphoma (ptcl).,['ONCOLOGY (263) ']
U-1180 ,treatment following infections: complicated skin skin structure infections staphylococcus aureus bloodstream infections (bacteremia) including right-sided infective endocarditis,['INFECTIONS AND INFECTIOUS DISEASES (211) ']
U-1517 ,treatment bacterial infections using two-dose regimen dalbavancin.,['INFECTIONS AND INFECTIOUS DISEASES (211) ']
U-2265 ,prevention nausea vomiting associated hec mec adult pediatric patients,['ONCOLOGY (263) ']
U-2260 ,"method reducing risk periprocedural myocardial infarction, stent thrombosis patient undergoing pci administering intravenously 30 ug/kg bolus pci continuous infusion",['CARDIOLOGY/VASCULAR DISEASES (122) ']
U-1715 ,p2y12 platelet inhibitor use adjunct percutaneous coronary intervention reduce risk various diseases/conditions patients treated p2y12 platelet inhibitor given glycoprotein iib/iiia inhibitor,['FAMILY MEDICINE (624) ']
U-1926 ,"method treating, reducing incidence of, preventing ischemic event patient undergoing pci administering intravenously 30 ug/kg bolus pci continuous infusion 4 ug/kg/min least 2 hours duration pci",['CARDIOLOGY/VASCULAR DISEASES (122) ']
U-1260 ,treatment patients multiple myeloma received least two prior therapies including bortezomib immunomodulatory agent demonstrated disease progression within 60 days completion last therapy,['FAMILY MEDICINE (624) ']
U-1924 ,kyprolis indicated combination lenalidomide plus dexamethasone treatment patients relapsed refractory multiple myeloma received one three lines therapy,['ONCOLOGY (263) ']
U-2319 ,kyprolis indicated combination dexamethasone lenalidomide plus dexamethasone treatment patients relapsed refractory multiple myeloma received one three lines therapy,['ONCOLOGY (263) ']
U-2320 ,kyprolis indicated single agent treatment patients relapsed refractory multiple myeloma received one lines therapy,['ONCOLOGY (263) ']
U-2449 ,treatment bacterial skin skin structure infection,['DERMATOLOGY (109) ']
U-1569 ,treatment bacterial skin skin structure infections,['DERMATOLOGY (109) ']
U-1570 ,treatment bacterial skin skin structure infections using single dose,['DERMATOLOGY (109) ']
U-282 ,method treating bacterial infections,['INFECTIONS AND INFECTIOUS DISEASES (211) ']
U-1676 ,methods treating bacterial infections,['INFECTIONS AND INFECTIOUS DISEASES (211) ']
U-2341 ,method reconstituting lyophilized liposomal composition administering cytarabine daunorubicin treat adults newly-diagnosed therapy-related acute myeloid leukemia (t-aml) aml myelodysplasia-related changes (aml-mrc),['ONCOLOGY (263) ']
U-2342 ,method administering reconstituted liposomal composition containing cytarabine daunorubicin treat adults newly-diagnosed therapy-related acute myeloid leukemia (t-aml) aml myelodysplasia-related changes (aml-mrc),['ONCOLOGY (263) ']
U-2090 ,treatment adults newly-diagnosed therapy-related acute myeloid leukemia (t-aml) aml myelodysplasia-related changes (aml-mrc),['ONCOLOGY (263) ']
U-36 ,methods treating bacterial illnesses,['INFECTIONS AND INFECTIOUS DISEASES (211) ']
U-1672 ,treatment complicated intra-abdominal infection,['INFECTIONS AND INFECTIOUS DISEASES (211) ']
U-1673 ,"treatment complicated urinary tract infection, including pyelonephritis",['INFECTIONS AND INFECTIOUS DISEASES (211) ']
U-2460 ,"visualization vessels, blood flow tissue perfusion coronary artery bypass graft vascular, gastrointestinal, organ transplant, plastic, micro- reconstructive, including minimally invasive, surgery",['CARDIOLOGY/VASCULAR DISEASES (122) ']
U-2461 ,"visualization vessels, blood flow tissue perfusion cardiovascular bypass graft vasculature vascular, gastrointestinal, organ transplant, plastic, micro- reconstructive, including minimally invasive, surgery",['CARDIOLOGY/VASCULAR DISEASES (122) ']
U-2462 ,"visualization vessels, blood flow tissue perfusion vessel arteriovenous malformation vascular, gastrointestinal, organ transplant, plastic, micro- reconstructive, including minimally invasive, surgery",['ONCOLOGY (263) ']
U-2463 ,"visualization vessels, blood flow tissue perfusion surgical flaps vascular, gastrointestinal, organ transplant, plastic, micro- reconstructive, including minimally invasive, surgery",['ONCOLOGY (263) ']
U-2464 ,"visualization vessels, blood flow tissue perfusion transplanted organ attached vessel vascular, gastrointestinal, organ transplant, plastic, micro- reconstructive, including minimally invasive, surgery",['ONCOLOGY (263) ']
U-2468 ,visualization extrahepatic biliary duct attached transplanted organ patients 12 years older,['FAMILY MEDICINE (624) ']
U-2465 ,"visualization vessels, blood flow tissue perfusion vessel graft vascular, gastrointestinal, organ transplant, plastic, micro- reconstructive, including minimally invasive, surgery",['ONCOLOGY (263) ']
U-2466 ,"visualization vessels, blood flow tissue perfusion donor organ attached vessel vascular, gastrointestinal, organ transplant, plastic, micro- reconstructive, including minimally invasive, surgery",['ONCOLOGY (263) ']
U-2467 ,visualization extrahepatic biliary duct attached donor organ patients 12 years older,['FAMILY MEDICINE (624) ']
U-257 ,treatment hiv infection,['INFECTIONS AND INFECTIOUS DISEASES (211) ']
U-1766 ,treatment hyperkalemia,['FAMILY MEDICINE (624) ']
U-1320 ,treatment adult patients short bowel syndrome dependent parenteral support,['FAMILY MEDICINE (624) ']
U-2308 ,treatment adult patients short bowel syndrome dependent parenteral support,['FAMILY MEDICINE (624) ']
U-1300 ,treatment patients tyrosine kinase inhibitor (tki) resistant intolerant chronic myeloid/myelogenous leukemia (cml),['ONCOLOGY (263) ']
U-1576 ,treatment leukemia,['ONCOLOGY (263) ']
U-2489 ,treatment moderate severe opioid use disorder,['NEUROLOGY (189) ']
U-2173 ,treating opioid dependence administering buprenorphine,['NEUROLOGY (189) ']
U-2174 ,treating opioid dependency administering buprenorphine per month,['NEUROLOGY (189) ']
U-2175 ,treating opioid dependency administering buprenorphine monthly,['NEUROLOGY (189) ']
U-2206 ,treating opioid dependency administering buprenorphine,['NEUROLOGY (189) ']
U-2176 ,treating opioid addiction administering buprenorphine,['NEUROLOGY (189) ']
U-2177 ,treating opioid addiction subcutaneous injection buprenorphine,['FAMILY MEDICINE (624) ']
U-2178 ,treating opioid addiction administering buprenorphine composition 28 day dose duration,['ONCOLOGY (263) ']
U-2209 ,treating opioid addiction administering buprenorphine per month,['NEUROLOGY (189) ']
U-2179 ,situ formation solid buprenorphine composition,['ONCOLOGY (263) ']
U-2180 ,treating addiction 100 mg 300 mg dose buprenorphine,['FAMILY MEDICINE (624) ']
U-2207 ,treating addiction subcutaneous injection buprenorphine,['FAMILY MEDICINE (624) ']
U-2208 ,treating addiction per month administration buprenorphine,['FAMILY MEDICINE (624) ']
U-2181 ,treating opioid dependency subcutaneously administering buprenorphine,['NEUROLOGY (189) ']
U-2210 ,treating opioid addiction 100 mg 300 mg dose buprenorphine,['FAMILY MEDICINE (624) ']
U-2211 ,treating opioid addiction administration buprenorphine,['NEUROLOGY (189) ']
U-1419 ,treatment acute cyanide poisoning judged life threatening,['FAMILY MEDICINE (624) ']
U-2015 ,sodium thiosulfate injection indicated sequential use sodium nitrite treatment acute cyanide poisoning,['FAMILY MEDICINE (624) ']
U-1834 ,treatment postoperative inflammation prevention ocular pain patients undergoing cataract surgery,['OPHTHALMOLOGY (56) ']
U-2222 ,relieves redness eye due minor eye irritations,['OPHTHALMOLOGY (56) ']
U-1680 ,treatment ocular itching associated allergic conjunctivitis,['OPHTHALMOLOGY (56) ']
U-1524 ,reduction elevated intraocular pressure,['OPHTHALMOLOGY (56) ']
U-1900 ,treatment signs symptoms dry eye disease (ded),['FAMILY MEDICINE (624) ']
U-1880 ,treatment signs symptoms dry eye disease (ded),['FAMILY MEDICINE (624) ']
U-1578 ,treatment acute otitis media,['FAMILY MEDICINE (624) ']
U-2440 ,maintenance treatment patients chronic obstructive pulmonary disease (copd),['PULMONARY/RESPIRATORY DISEASES (135) ']
U-2236 ,reducing risk preterm birth women singleton pregnancy history singleton spontaneous preterm birth,['OBSTETRICS/GYNECOLOGY (WOMEN’S HEALTH) (120) ']
U-1942 ,treatment spinal muscular atrophy increasing exon-7 inclusion smn2 mrna,['MUSCULOSKELETAL (109) ']
U-1943 ,treatment spinal muscular atrophy,['MUSCULOSKELETAL (109) ']
U-1944 ,treatment spinal muscular atrophy inhibiting smn2 pre-mrna intronic splicing silencer site,['FAMILY MEDICINE (624) ']
U-1941 ,treatment infantile-onset spinal muscular atrophy,['NEUROLOGY (189) ']
U-2093 ,treatment type ii spinal muscular atrophy,['ENDOCRINOLOGY (229) ']
U-2094 ,treatment type iii spinal muscular atrophy,['FAMILY MEDICINE (624) ']
U-298 ,method combating bacteria patient,['FAMILY MEDICINE (624) ']
U-2450 ,positron emission tomography diagnostic agent adults suspected prostate cancer recurrence based elevated blood prostate specific antigen levels following prior treatment,['UROLOGY (54) ']
U-1879 ,method diagnosing tumors using positron emission tomography,['FAMILY MEDICINE (624) ']
U-1795 ,reversal neuromuscular blockage induced rocuronium bromide vecuronium bromide,['PHARMACOLOGY/TOXICOLOGY (32) ']
U-1794 ,reversal drug-induced neuromuscular block,['PHARMACOLOGY/TOXICOLOGY (32) ']
U-1815 ,treatment partial-onset seizures adjunctive therapy patients epilepsy aged 16 years older epilepsy,['NEUROLOGY (189) ']
U-2130 ,treatment partial onset seizures patients epilepsy aged 16 years older epilepsy,['NEUROLOGY (189) ']
U-981 ,"management mild moderate pain, management moderate severe pain adjunct opioid analgesics, reduction fever anti-inflammatory, analgesic, antipyretic activity",['NEUROLOGY (189) ']
U-1599 ,"management mild moderate pain, management moderate severe pain adnunct opioid analgesics, reduction fever anti inflammatory, analgesic, antipyretic activity",['NEUROLOGY (189) ']
U-2264 ,"methods treating pain, inflammation, fever, patent ductus arteriosis aqueous composition",['NEUROLOGY (189) ']
U-2266 ,"methods making aqueous composition treating pain, inflammation, fever, patent ductus arteriosis aqueous composition",['NEUROLOGY (189) ']
U-1735 ,"methods treating pain, inflammation and/or fever intravenous ibuprofen mean arterial blood pressure increase dosage interval",['NEUROLOGY (189) ']
U-1756 ,"methods treating pain, inflammation and/or fever critically ill patient intravenous ibuprofen need thereof",['NEUROLOGY (189) ']
U-2018 ,"management mild moderate pain, management moderate severe pain adjunct opioid analgesics critically ill patient intravenous ibuprofen need thereof",['NEUROLOGY (189) ']
U-2004 ,replacement therapy oral carbamazepine adults partial seizures complex symptomatology,['NEUROLOGY (189) ']
U-2005 ,replacement therapy oral carbamazepine adults generalized tonic-clonic seizures,['NEUROLOGY (189) ']
U-2006 ,"replacement therapy oral carbamazepine adults mixed seizure patterns include partial seizures complex symptomatology, generalized tonic-clonic seizures, partial generalized seizures",['NEUROLOGY (189) ']
U-1239 ,magnetic resonance imaging liver,['ONCOLOGY (263) ']
U-1904 ,(i)treatment duchenne muscular dystrophy; (ii)restoring/increasing functional dystrophin protein; (iii) inducing skipping; (i)-(iii) patients confirmed mutation dmd gene amenable exon 51 skipping,['MUSCULOSKELETAL (109) ']
U-2097 ,treatment dmd patients mutation dmd gene amenable exon 51 skipping,['NEUROLOGY (189) ']
U-2098 ,increasing production functional dystrophin protein dmd patients mutation dmd gene amenable exon 51 skipping,['NEUROLOGY (189) ']
U-1918 ,treatment duchenne muscular dystrophy patients mutation dmd gene amenable exon 51 skipping,['MUSCULOSKELETAL (109) ']
U-1919 ,restoring mrna reading frame induce dystrophin protein production patients mutation dmd gene amenable exon 51 skipping,['NEUROLOGY (189) ']
U-1422 ,method treating patients needing iron supplement,['FAMILY MEDICINE (624) ']
U-1119 ,contrast agent magnetic resonance imaging,['ONCOLOGY (263) ']
