 Use Code,Use,TreatmentTherapeutic_Area
U-1776 ,method using cobimetinib treatment melanoma,['FAMILY MEDICINE (624) ']
U-618 ,"use rosuvastatin calcium reduce elevated total-c, ldl-c, apob, nonhdl-c tg levels; increase hdl-c adult patients primary hyperlipidemia mixed dyslipidemia; slow progression atherosclerosis.",['CARDIOLOGY/VASCULAR DISEASES (122) ']
U-1032 ,use rosuvastatin calcium primary prevention cardiovascular disease individuals without clinically evident coronary heart disease increased risk factors,['CARDIOLOGY/VASCULAR DISEASES (122) ']
U-1807 ,treatment pediatric patients 8 17 years age heterozygous familial hypercholesterolemia (hefh),['FAMILY MEDICINE (624) ']
U-1724 ,method inhibiting hepatitis c virus,['IMMUNOLOGY (216) ']
U-1725 ,method inhibiting hepatitis c virus daklinza least one additional compound anti-hcv activity,"['HEPATOLOGY (LIVER, PANCREATIC, GALL BLADDER) (54) ']"
U-1115 ,treatment reduce risk copd exacerbations patients severe copd associated chronic bronchitis history exacerbations,['PULMONARY/RESPIRATORY DISEASES (135) ']
U-2395 ,treatment hiv-1 infection adult patients prior antiretroviral treatment history,['FAMILY MEDICINE (624) ']
U-2314 ,treatment thrombocytopenia adult patient chronic liver disease scheduled undergo procedure using doptelet,"['HEPATOLOGY (LIVER, PANCREATIC, GALL BLADDER) (54) ']"
U-594 ,prevention postmenopausal osteoporosis,['MUSCULOSKELETAL (109) ']
U-904 ,treatment moderate severe vasomotor symptoms associated menopause,['FAMILY MEDICINE (624) ']
U-1153 ,"combination antiretroviral agents, indicated treatment human immunodeficiency virus type 1 (hiv-1) infection antiretroviral treatment-naive adult patients, set forth labeling, including i&u; section",['IMMUNOLOGY (216) ']
U-1307 ,"combination antiretroviral agents treatment hiv-1 infection treatment-naive adult patients hiv-1 rna less equal 100,000 start therapy",['INFECTIONS AND INFECTIOUS DISEASES (211) ']
U-1740 ,"combination antiretroviral agents treatment hiv-1 infection treatment-naive patients hiv-1 rna less equal 100,000 start thearpy",['INFECTIONS AND INFECTIOUS DISEASES (211) ']
U-1381 ,use prasugrel aspirin patients requiring reduction thrombotic cardiovascular events,['CARDIOLOGY/VASCULAR DISEASES (122) ']
U-1723 ,treatment heart failure,['FAMILY MEDICINE (624) ']
U-1470 ,treatment hepatitis c,['IMMUNOLOGY (216) ']
U-2381 ,"treatment combination gnrh agonist non-metastatic, castration-resistant prostate cancer (nm-crpc)",['ONCOLOGY (263) ']
U-2382 ,"treatment combination gnrh agonist high risk non-metastatic, castration-resistant prostate cancer (nm-crpc)",['ONCOLOGY (263) ']
U-2237 ,"treatment non-metastatic, castration-resistant prostate cancer (nm-crpc)",['ONCOLOGY (263) ']
U-2269 ,"dosage modification following grade 2 abnormality liver function biomarker pirfenidone administration, administering sub-2400mg/day dose full daily dose treatment ipf",['FAMILY MEDICINE (624) ']
U-2270 ,"dosage modification following grade 2 abnormality liver function biomarker pirfenidone administration, discontinuing pirfenidone biomarkers within normal limits, sub-2400mg/day dose, full daily dose treatment ipf",['FAMILY MEDICINE (624) ']
U-2072 ,full daily dosing following grade 2 abnormality liver function biomarker pirfenidone administration treatment ipf,['FAMILY MEDICINE (624) ']
U-2073 ,"dosage modification following grade 2 abnormality liver function biomarker pirfenidone administration, discontinuing pirfenidone biomarkers within normal limits, followed administering full daily dose treatment ipf",['FAMILY MEDICINE (624) ']
U-2074 ,dosing 1602 mg/day pirfenidone following grade 2 abnormality liver function biomarker pirfenidone administration treatment ipf,['FAMILY MEDICINE (624) ']
U-2075 ,"dosage modification following grade 2 abnormality liver function biomarker pirfenidone administration, discontinuing pirfenidone biomarkers within normal limits followed administering 1602 mg/day treatment ipf",['FAMILY MEDICINE (624) ']
U-2076 ,"dosage modification following grade 2 abnormality liver function biomarker pirfenidone administration, administering 801 mg/day followed administering 1602 mg/day treatment ipf",['FAMILY MEDICINE (624) ']
U-2083 ,"dosage modification following grade 2 abnormality liver function biomarker pirfenidone administration, discontinuing pirfenidone biomarkers within normal limits, followed 801 mg/day, dose, 1602 mg/day treatment ipf",['FAMILY MEDICINE (624) ']
U-2080 ,"pirfenidone dose escalation regimen treatment ipf 801 mg/day days 1-7 regimen, 1602 mg/day days 8-14 regimen, 2403 mg/day least day 15 regimen",['FAMILY MEDICINE (624) ']
U-2042 ,discontinuing administration fluvoxamine avoid drug interactions pirfenidone administering pirfenidone,['FAMILY MEDICINE (624) ']
U-2050 ,administering pirfenidone avoiding co-administration fluvoxamine avoid drug interactions pirfenidone,['FAMILY MEDICINE (624) ']
U-2048 ,administering pirfenidone avoiding co-administration strong cyp1a2 inhibitor avoid drug interactions pirfenidone,['FAMILY MEDICINE (624) ']
U-2049 ,discontinuing administration strong cyp1a2 inhibitor avoid drug interactions pirfenidone administering pirfenidone,['FAMILY MEDICINE (624) ']
U-2047 ,"administering pirfenidone concurrently fluvoxamine, pirfenidone dose 801 mg/day reduce drug interactions fluvoxamine",['FAMILY MEDICINE (624) ']
U-2082 ,modifying pirfenidone administration dose 2400 mg/day downward 1600 mg/day co-administering fluvoxamine reduce drug interactions fluvoxamine,['FAMILY MEDICINE (624) ']
U-2054 ,administering pirfenidone avoiding concomitant administration strong inducer cyp1a2 avoid reduced pirfenidone efficacy,['FAMILY MEDICINE (624) ']
U-2268 ,discontinuing strong cyp1a2 inducer avoid reduced pirfenidone efficacy administering pirfenidone,['FAMILY MEDICINE (624) ']
U-2046 ,"administering pirfenidone avoiding concomitant use cyp1a2 inhibitor moderate strong inhibitor cyp1a2 another cyp enzyme selected cyp2c9, cyp2c19, cyp2d6",['FAMILY MEDICINE (624) ']
U-2081 ,"discontinuing use cyp1a2 inhibitor moderate strong inhibitor cyp1a2 another cyp enzyme selected cyp2c9, cyp2c19, cyp2d6 administering pirfenidone",['FAMILY MEDICINE (624) ']
U-2079 ,"pirfenidone dose escalation regimen treatment fibrosis 801 mg/day days 1-7 regimen, 1602 mg/day days 8-14 regimen, 2403 mg/day least day 15 regimen",['FAMILY MEDICINE (624) ']
U-2055 ,dosing least 1600 mg/day following grade 2 liver abnormality biomarker ast and/or alt pirfenidone administration treatment ipf,['FAMILY MEDICINE (624) ']
U-2056 ,"dosage modification following grade 2 abnormality biomarker ast and/or alt pirfenidone administration, administering sub-1600 mg/day, following administering least 1600 mg/day treatment ipf",['FAMILY MEDICINE (624) ']
U-2057 ,dosing 2403 mg/day pirfenidone following grade 2 abnormality biomarker ast and/or alt pirfenidone administration treatment ipf,['FAMILY MEDICINE (624) ']
U-2058 ,"dosage modification following grade 2 abnormality biomarker ast and/or alt pirfenidone administration, administering sub-2400mg/day dose, followed administering 2403mg/day treatment ipf",['FAMILY MEDICINE (624) ']
U-2059 ,"dosage modification following grade 2 abnormality biomarker ast and/or alt pirfenidone administration, discontinuing pirfenidone biomarkers liver function within normal limits, followed full daily dose treatment ipf",['FAMILY MEDICINE (624) ']
U-2060 ,"dosage modification following grade 2 abnormality biomarker ast and/or alt pirfenidone administration, discontinuing pirfenidone biomarkers liver function within normal limits, least 1600mg/day treatment ipf",['FAMILY MEDICINE (624) ']
U-2061 ,dosing least 1600 mg/day following grade 2 abnormality liver function biomarker pirfenidone administration treatment ipf,['FAMILY MEDICINE (624) ']
U-2062 ,"dosage modification following grade 2 abnormality liver function biomarker pirfenidone administration, administering sub-1600 mg/day dose, followed administering least 1600 mg/day dose treatment ipf",['FAMILY MEDICINE (624) ']
U-2063 ,"dosage modification following grade 2 abnormality liver function biomarker pirfenidone administration, discontinuing pirfenidone biomarkers within normal limits, followed administering least 1600 mg/day treatment ipf",['FAMILY MEDICINE (624) ']
U-2064 ,dosing least 1602 mg/day following grade 2 abnormality liver function biomarker alt ast pirfenidone administration,['FAMILY MEDICINE (624) ']
U-2065 ,full daily dosing following grade 2 abnormality liver function biomarker alt ast pirfenidone administration,['FAMILY MEDICINE (624) ']
U-2066 ,"dosage modification following grade 2 abnormality liver function biomarker alt ast pirfenidone administration, administering sub-2400 mg/day dose, followed full daily dose",['FAMILY MEDICINE (624) ']
U-2067 ,"dosage modification following grade 2 abnormality liver function biomarker alt ast pirfenidone administration, discontinuing pirfenidone, followed administering least 1602 mg/day",['FAMILY MEDICINE (624) ']
U-2068 ,"dosage modification following grade 2 abnormality liver function biomarker alt ast pirfenidone administration, discontinuing pirfenidone biomarkers liver function within normal limits, followed full daily dose",['INFECTIONS AND INFECTIOUS DISEASES (211) ']
U-2069 ,"dosage modification following grade 2 abnormality liver function biomarker alt ast pirfenidone administration, administering sub-1600 mg/day dose, followed administering least 1602 mg/day",['FAMILY MEDICINE (624) ']
U-2070 ,"dosage modification following grade 2 abnormality biomarker alt ast pirfenidone administration, discontinuing pirfenidone biomarkers liver function within normal limits, sub-1600 mg/day, least 1602 mg/day",['FAMILY MEDICINE (624) ']
U-2051 ,discontinuing smoking avoid reduced pirfenidone efficacy administering pirfenidone,['PSYCHIATRY/PSYCHOLOGY (73) ']
U-2052 ,discontinuing administration strong cyp1a2 inducer avoid reduced pirfenidone efficacy administering pirfenidone,['FAMILY MEDICINE (624) ']
U-2053 ,"administering pirfenidone avoiding concomitant administration strong inducer cyp1a2, including cigarette smoke, avoid reduced pirfenidone efficacy",['FAMILY MEDICINE (624) ']
U-2044 ,"dose reduction pirfenidone one half concurrent administration ciprofloxacin dose 750 mg twice daily (1500 mg/day) reduce drug interactions treatment fibrotic, inflammatory, autoimmune disorder",['FAMILY MEDICINE (624) ']
U-2045 ,"administration pirfenidone avoiding concurrent administration ciprofloxacin dose 750 mg reduce drug interactions treatment fibrotic, inflammatory, autoimmune disorder",['PSYCHIATRY/PSYCHOLOGY (73) ']
U-2077 ,"dosage modification following grade 2 abnormality liver function biomarker pirfenidone administration, administering sub-2400 mg/day dose full day daily dose treatment ipf",['FAMILY MEDICINE (624) ']
U-2078 ,"dosage modification following grade 2 abnormality liver function biomarker pirfenidone administration, discontinuing pirfenidone biomarkers within limits, sub-2400mg/day dose, full daily dose treatment ipf",['FAMILY MEDICINE (624) ']
U-1625 ,method treating schizophrenia administering iloperidone patient reducing dose patients poor metabolizers cyp2d6,['PSYCHIATRY/PSYCHOLOGY (73) ']
U-1685 ,dosage modification reduce risk associated qt prolongation induced drugs treatment iloperidone,['FAMILY MEDICINE (624) ']
U-1674 ,dosage modification reduce risks associated qt prolongation induced drugs treatment iloperidone,['FAMILY MEDICINE (624) ']
U-1737 ,method treating schizophrenia administering iloperidone patient reducing dose patients treated fluoxetine,['PSYCHIATRY/PSYCHOLOGY (73) ']
U-2212 ,reducing fasting plasma glucose human need thereof combination sustained-release composition containing exendin-4,['FAMILY MEDICINE (624) ']
U-2213 ,reducing hba1c human need thereof combination sustained-release composition containing exendin-4,['FAMILY MEDICINE (624) ']
U-106 ,treatment epilepsy,['FAMILY MEDICINE (624) ']
U-2088 ,treatment partial-onset seizures without secondarily generalized seizures patients epilepsy,['NEUROLOGY (189) ']
U-2089 ,treatment primary generalized tonic-clonic seizures adjunctive therapy patients epilepsy,['NEUROLOGY (189) ']
U-2428 ,treatment partial-onset seizures without secondarily generalized seizures patients epilepsy 4 years age older,['NEUROLOGY (189) ']
U-2429 ,treatment primary generalized tonic-clonic seizures adjunctive therapy patients epilepsy 12 years age older,['NEUROLOGY (189) ']
U-1279 ,treatment hiv infection using composition containing pharmacokinetic enhancer inhibits cytochrome p450 monooxygenase,['INFECTIONS AND INFECTIOUS DISEASES (211) ']
U-1950 ,treatment patients advanced (metastatic) non-small cell lung cancer whose disease progressed platinum-based chemotherapy,['ONCOLOGY (263) ']
U-649 ,method treating tumor disease,['NEUROLOGY (189) ']
U-791 ,gleevec also indicated treatment patients kit (cd117) positive unresectable and/or metastatic malignant gastrointestinal stromal tumors (gist),['ONCOLOGY (263) ']
U-1883 ,treatment gastrointestinal stromal tumors (gist),['GASTROENTEROLOGY (105) ']
U-1652 ,method treating type 2 diabetes mellitus administering linagliptin combination empagliflozin metformin,['ENDOCRINOLOGY (229) ']
U-1651 ,method treating type 2 diabetes mellitus administering linagliptin combination empagliflozin,['ENDOCRINOLOGY (229) ']
U-1653 ,method treating type 2 diabetes mellitus administering linagliptin combination empagliflozin (with without metformin),['ENDOCRINOLOGY (229) ']
U-1654 ,method treating type 2 diabetes mellitus administering linagliptin combination empagliflozin (with without insulin sulfonylurea),['ENDOCRINOLOGY (229) ']
U-1772 ,method treating type 2 diabetes mellitus administering linagliptin combination empagliflozin,['ENDOCRINOLOGY (229) ']
U-1114 ,"treatment gabapentin, including treatment neuropathic pain, including neuropathic pain associated postherpetic neuralgia",['NEUROLOGY (189) ']
U-2369 ,"treatment genotype 1, 4, 5 6 chronic hepatitis c virus (hcv) infection","['HEPATOLOGY (LIVER, PANCREATIC, GALL BLADDER) (54) ']"
U-2370 ,treatment-naive genotype 1 patients chronic hepatitis c virus (hcv) infection duration 8-weeks,"['HEPATOLOGY (LIVER, PANCREATIC, GALL BLADDER) (54) ']"
U-1699 ,method treating acute lymphoblastic leukemia,['ONCOLOGY (263) ']
U-1700 ,method treating philadelphia chromosome positive acute lymphoblastic leukemia,['ONCOLOGY (263) ']
U-1701 ,method treating leukemia resulting mutation bcr-abl kinase domain,['ONCOLOGY (263) ']
U-1948 ,method treating chronic myeloid leukemia,['ONCOLOGY (263) ']
U-2087 ,treatment relapsed refractory acute myeloid leukemia (aml) isocitrate dehydrogenase-2 (idh2) mutation,['ONCOLOGY (263) ']
U-2243 ,treatment chronic lymphocytic leukemia/small lymphocytic lymphoma 17p deletion,['ONCOLOGY (263) ']
U-256 ,treatment hiv infection combination one additional hiv antiviral agents,['INFECTIONS AND INFECTIOUS DISEASES (211) ']
U-1016 ,"combination antiretroviral agents treatment hiv-1 infection treatment-experienced adult patients, evidence viral replication hiv-1 strains resistant nnrti antiretroviral agents",['INFECTIONS AND INFECTIOUS DISEASES (211) ']
U-1237 ,"combo w/ antiretrovirals tx hiv-1 antiretroviral tx-experienced pt 6 years up, evidence viral replication hiv-1 strains resistant non-nucleoside reverse transcriptase inhibitor antiretrovirals",['INFECTIONS AND INFECTIOUS DISEASES (211) ']
U-2354 ,combination antiretrovirals (atv) treatment hiv-1 atv treatment-experienced patients 2 years older evidence viral replication hiv-1 strains resistant non-nucleoside reverse transcriptase inhibitor atv,['INFECTIONS AND INFECTIOUS DISEASES (211) ']
U-900 ,integrase inhibition treatment hiv infection,['INFECTIONS AND INFECTIOUS DISEASES (211) ']
U-1201 ,treatment intermediate high-risk myelofibrosis,['FAMILY MEDICINE (624) ']
U-1622 ,treatment polycythemia vera,['FAMILY MEDICINE (624) ']
U-1573 ,use ruxolitinib (jakafi) inhibiting janus associated kinases (jaks) jak1 and/or jak2.,['FAMILY MEDICINE (624) ']
U-1721 ,use ruxolitinib (jakafi) blocking signal transduction janus associated kinases (jaks) jak1 and/or jak2,['FAMILY MEDICINE (624) ']
U-2292 ,method reducing risk cardiovascular death adult patients type 2 diabetes mellitus cardiovascular disease daily administration 10 mg 25 mg empagliflozin,['FAMILY MEDICINE (624) ']
U-2307 ,treatment autosomal dominant polycystic kidney disease,['NEPHROLOGY (88) ']
U-1335 ,methods modifying glucose metabolism treating diabetes comprising administering dipeptidyl peptidase inhibitor one therapeutic agents metformin,['FAMILY MEDICINE (624) ']
U-1336 ,methods treating diabetes comprising administering dipeptidyl peptidase inhibitor metformin,['FAMILY MEDICINE (624) ']
U-1337 ,method treating diabetes comprising administering alogliptin,['FAMILY MEDICINE (624) ']
U-1338 ,method treating diabetes comprising administering compound alogliptin,['FAMILY MEDICINE (624) ']
U-2355 ,"combination aromatase inhibitor treatment pre/perimenopausal postmenopausal women hr-positive, her2-negative advanced metastatic breast cancer, initial endocrine-based therapy",['ONCOLOGY (263) ']
U-2356 ,"combination fulvestrant treatment postmenopausal women hr-positive, her2-negative advanced metastatic breast cancer, initial endocrine based therapy following disease progression endocrine therapy",['ONCOLOGY (263) ']
U-1643 ,treating cushing's syndrome,['FAMILY MEDICINE (624) ']
U-1770 ,treatment schizophrenia improvement negative symptoms and/or cognitive dysfunction schizophrenia,['PSYCHIATRY/PSYCHOLOGY (73) ']
U-1822 ,treatment schizophrenia bipolar depression improvement attention function schizophrenia and/or bipolar disorder,['PSYCHIATRY/PSYCHOLOGY (73) ']
U-2166 ,treatment major depressive episodes associated bipolar disorder,['PSYCHIATRY/PSYCHOLOGY (73) ']
U-2199 ,treatment schizophrenia improvement attention function schizophrenia,['PSYCHIATRY/PSYCHOLOGY (73) ']
U-2201 ,treatment bipolar depression improvement attention function bipolar disorder,['PSYCHIATRY/PSYCHOLOGY (73) ']
U-1754 ,treatment pulmonary hypertension (pah) combination tadalafil,['FAMILY MEDICINE (624) ']
U-1965 ,"treatment pulmonary arterial hypertension (pah) combination tadalafil, wherein weight ratio ambrisentan tadalafil 1:2 1:3",['FAMILY MEDICINE (624) ']
U-1751 ,"treatment patients metastatic colorectal cancer previously treated fluoropyrimidine-, oxaliplatin- irinotecan-based chemotherapy, anti-vegf biological therapy, ras wild-type, anti-egfr therapy",['ONCOLOGY (263) ']
U-2101 ,"maintenance treatment recurrent epithelial ovarian, fallopian tube primary peritoneal cancer, complete partial response platinum-based chemotherapy",['ONCOLOGY (263) ']
U-2103 ,"maintenance treatment brca-mutated recurrent epithelial ovarian, fallopian tube primary peritoneal cancer, complete partial response platinum-based chemotherapy",['ONCOLOGY (263) ']
U-2480 ,"maintenance treatment gbrca- sbrca-mutated advanced epithelial ovarian, fallopian tube primary peritoneal cancer complete partial response first-line platinum-based chemotherapy",['ONCOLOGY (263) ']
U-2481 ,treatment deleterious suspected deleterious germline brca-mutated advanced ovarian cancer treated three prior lines chemotherapy,['ONCOLOGY (263) ']
U-2482 ,"treatment hr-negative, her-2 negative, gbrca-mutated metastatic breast cancer, treated chemotherapy neoadjuvant, adjuvant, metastatic setting",['ONCOLOGY (263) ']
U-2483 ,"treatment hr-positive, her-2 negative, gbrca-mutated metastatic breast cancer, treated chemotherapy neoadjuvant, adjuvant, metastatic setting, endocrine therapy inappropriate endocrine therapy",['ONCOLOGY (263) ']
U-2141 ,"treatment chronic hepatitis c virus (hcv) genotype 1, 2, 3, 4, 5, 6","['HEPATOLOGY (LIVER, PANCREATIC, GALL BLADDER) (54) ']"
U-1712 ,mekinist combination dabrafenib treatment patients unresectable metastatic melanoma,['ONCOLOGY (263) ']
U-2033 ,"mekinist indicated, single agent combination dabrafenib, treatment patients unresectable metastatic melanoma braf v600e v600k mutations",['DERMATOLOGY (109) ']
U-1581 ,combination dabrafenib treatment unresectable metastatic melanoma.,['DERMATOLOGY (109) ']
U-1582 ,treatment unresectable metastatic melanoma,['DERMATOLOGY (109) ']
U-2020 ,"mekinist indicated, combination dabrafenib, treatment patients metastatic non-small cell lung cancer (nsclc) braf v600e mutation detected fda-approved test",['ONCOLOGY (263) ']
U-2037 ,"mekinist indicated, single agent combination dabrafenib, treatment patients unresectable metastatic melanoma braf v600e v600k mutations, detected fda-approved test",['DERMATOLOGY (109) ']
U-2302 ,"mekinist indicated, combination dabrafenib, adjuvant treatment patients melanoma braf v600e v600k mutations, detected fda-approved test, involvement lymph node(s), following complete resection",['DERMATOLOGY (109) ']
U-2305 ,"mekinist indicated, combination dabrafenib, treatment patients locally advanced metastatic anaplastic thyroid cancer (atc) braf v600e mutation satisfactory locoregional treatment options",['ONCOLOGY (263) ']
U-2331 ,indicated combination encorafenib treatment melanoma,['FAMILY MEDICINE (624) ']
U-2330 ,method treating melanoma,['DERMATOLOGY (109) ']
U-2332 ,indicated combination encorafenib treatment melanoma mediated b-raf protein kinase,['FAMILY MEDICINE (624) ']
U-2333 ,indicated combination encorafenib treatment melanoma braf mutation,['ONCOLOGY (263) ']
U-1185 ,treatment opioid-induced constipation,['GASTROENTEROLOGY (105) ']
U-2344 ,treatment thrombocytopenia adult patients chronic liver disease scheduled undergo procedure,"['HEPATOLOGY (LIVER, PANCREATIC, GALL BLADDER) (54) ']"
U-2043 ,"extended adjuvant treatment adult patients early stage her2-overexpressed/amplified breast cancer, follow adjuvant trastuzumab base therapy",['ONCOLOGY (263) ']
U-1459 ,treatment carcinoma thyroid,['FAMILY MEDICINE (624) ']
U-1696 ,treatment unresectable hepatocellular carcinoma,['ONCOLOGY (263) ']
U-1624 ,"treatment unresectable hepatocellular carcinoma, advanced renal cell carcinoma, differentiated thyroid carcinoma.",['ONCOLOGY (263) ']
U-2107 ,"treatment locally recurrent metastatic, progressive, differentiated thyroid carcinoma refractory radioactive iodine treatment",['ONCOLOGY (263) ']
U-2444 ,treatment subjects bacterial skin skin structure infection,['DERMATOLOGY (109) ']
U-1854 ,treatment primary biliary cholangitis (pbc),['FAMILY MEDICINE (624) ']
U-995 ,method treating type ii diabetes administering saxagliptin,['ENDOCRINOLOGY (229) ']
U-1837 ,"method treating type ii diabetes mellitus administering saxagliptin alone combination insulin, metformin, thiazolidinedione, glyburide metformin plus sulfonylurea",['ENDOCRINOLOGY (229) ']
U-1446 ,method treating pulmonary hypertension comprising administering macitentan combination compound phosphodiesterase-5 inhibitory properties,['CARDIOLOGY/VASCULAR DISEASES (122) ']
U-1445 ,"method treating pulmonary arterial hypertension administering pharmaceutical composition comprising macitentan polysorbate, wherin polysorbate represents 0.1 1% weight said pharmaceutical composition",['CARDIOLOGY/VASCULAR DISEASES (122) ']
U-1820 ,"method treating pulmonary arterial hypertension administering pharmaceutical composition comprising macitentan polysorbate, wherein polysorbate represents 0.1 3% weight said pharmaceutical composition",['CARDIOLOGY/VASCULAR DISEASES (122) ']
U-2360 ,management moderate severe pain associated endometriosis,['NEUROLOGY (189) ']
U-2411 ,"treatment cystic fibrosis patient age 12 years older homozygous f508del mutation cftr gene using tablet comprising lumacaftor recited claim 1, 19, 21 u.s. patent no. 10,076,513 ivacaftor",['PULMONARY/RESPIRATORY DISEASES (135) ']
U-1973 ,"method treating cystic fibrosis using n-(5-hydroxy-2,4-ditert-butyl-phenyl)-4-oxo-1h-quinoline-3-carboxamide 3-(6-(1-2,2-difluorobenzo[d][1,3]dioxol-5-yl) cyclopropanecarboxamido)-3-methylpyridin-2-yl)benzoic acid","['HEPATOLOGY (LIVER, PANCREATIC, GALL BLADDER) (54) ']"
U-1911 ,method treating patient cystic fibrosis using ivacaftor lumacaftor,"['HEPATOLOGY (LIVER, PANCREATIC, GALL BLADDER) (54) ']"
U-1718 ,method treating cystic fibrosis patients f508del mutation cystic fibrosis transmembrane conductance regulator (cftr) gene.,"['HEPATOLOGY (LIVER, PANCREATIC, GALL BLADDER) (54) ']"
U-1910 ,"method treating cystic fibrosis patient, patient f508del mutation cftr, using dosage unit claim 1 u.s. patent no. 8,716,338","['HEPATOLOGY (LIVER, PANCREATIC, GALL BLADDER) (54) ']"
U-1717 ,method treating cystic fibrosis patients homozygous f508del mutation cystic fibrosis transmembrane conductance regulator (cftr) gene,"['HEPATOLOGY (LIVER, PANCREATIC, GALL BLADDER) (54) ']"
U-1909 ,"method treating cystic fibrosis patient, patient f508del mutation cftr, using ivacaftor lumacaftor","['HEPATOLOGY (LIVER, PANCREATIC, GALL BLADDER) (54) ']"
U-1908 ,"method treating cystic fibrosis patient, patient f508del mutation cftr, using ivacaftor form lumacaftor","['HEPATOLOGY (LIVER, PANCREATIC, GALL BLADDER) (54) ']"
U-1912 ,"method treating cystic fibrosis patient, patient f508del mutation cftr, using dosage unit defined claim 1 u.s. patent no. 9,192,606","['HEPATOLOGY (LIVER, PANCREATIC, GALL BLADDER) (54) ']"
U-2276 ,method treating cystic fibrosis patient age 6 older homozygous f508del mutation cftr gene using lumacaftor solid composition comprising amorphous (less 30% crystalline) ivacaftor,['PULMONARY/RESPIRATORY DISEASES (135) ']
U-1334 ,methods treating diabetes comprising administering insulin sensitivity enhancer pioglitazone combination insulin secretion enhancer,['ENDOCRINOLOGY (229) ']
